{
  "event_id": "018f8b45-b634-7c81-a47d-9a7c2f3cc201",
  "event_type": "article.enriched",
  "event_version": 1,
  "occurred_at": "2026-08-01T12:05:00Z",
  "producer": "ai-content-service",
  "correlation_id": "018f8b45-b634-7c81-a47d-9a7c2f3cc202",
  "causation_id": "018f8b45-b634-7c81-a47d-9a7c2f3cc203",
  "aggregate_type": "article_version",
  "aggregate_id": "018f8b45-b634-7c81-a47d-9a7c2f3c3101",
  "idempotency_key": "article-version:018f8b45-b634-7c81-a47d-9a7c2f3c3101:enriched:v1",
  "payload": {
    "article_version_id": "018f8b45-b634-7c81-a47d-9a7c2f3c3101",
    "input_hash": "aaaaaaaaaaaaaaaaaaaaaaaaaaaaaaaaaaaaaaaaaaaaaaaaaaaaaaaaaaaaaaaa",
    "enrichment_id": "018f8b45-b634-7c81-a47d-9a7c2f3cc204",
    "validation_status": "PARTIAL",
    "valid_claim_count": 2,
    "rejected_claim_count": 1,
    "model_version": "qwen3-8b-fixture",
    "prompt_version": "article-enrichment-v1",
    "validator_version": "grounding-v1"
  }
}
